id,name,project-image,meta-info,article-link,source
1,"Shall Make, Shall Be: The Bill of Rights at Play",https://shallmakeshallbe.org/images/artscodes_tenthamendment.jpg,Audio Synthesis and HCI,https://shallmakeshallbe.org/tenth_amendment.html,The Frank-Ratchye Studio for Creative Inquiry at Carnegie Mellon University
2,Stony Brook Professor Creates Soundtrack to Civics Lesson,https://news.stonybrook.edu/wp-content/uploads/2022/07/amendment-art-installation-370x493.jpg,Audio Synthesis and HCI,https://news.stonybrook.edu/university/stony-brook-professor-creates-soundtrack-to-civics-lesson/,Stony Brook University News
3,2021 Search for New Music Winners,https://www.stonybrook.edu/commcms//iacs/_images/schedel%20news.png,Audio Synthesis and HCI,https://iawm.org/2021-search-for-new-music-winners/,The International Alliance for Women in Music
4,"Women’s Labor: Embedded Iron by Jocelyn Ho with Margaret Schedel, Robert Cosgrove and Omkar Bhatt",https://i1.wp.com/www.harvestworks.org/wp-content/uploads/2021/06/Housework-Lock-Her-Down_pc_Jocelyn-Ho.png?ssl=1,Audio Synthesis and HCI,https://www.harvestworks.org/oct-9-oct-17-womens-labor-embedded-iron-by-jocelyn-ho/,Harvest Works
5,AI and Music Initiative Brings Computing and the Humanities Together,https://news.stonybrook.edu/wp-content/uploads/2020/05/article-image-03.jpg,Audio Synthesis and Data Science,https://news.stonybrook.edu/homespotlight/ai-and-music-initiative-brings-computing-and-the-humanities-together/,Stony Brook University News
6,2020-2021  Student Life Awards Winners,https://cdn.pixabay.com/photo/2019/07/06/18/17/radio-4320926_640.jpg,Radio Show Host,https://www.stonybrook.edu/commcms/studentaffairs/sac/Awards/past_sla_winners/2020-2021,Stony Brook University News